{
  "$schema": "https://json-schema.org/draft/2020-12/schema",
  "$id": "https://raw.githubusercontent.com/api-evangelist/waodao/main/json-schema/waodao-schema-response-schema.json",
  "title": "SchemaResponse",
  "x-generated": "2026-10-23",
  "x-method": "derived",
  "x-generator": "derive-json-schema.py",
  "x-source": "openapi/waodao-schema-api-openapi.yml#/components/schemas/SchemaResponse",
  "type": "object",
  "required": [
    "schema",
    "description",
    "endpoints",
    "agent_context",
    "fields"
  ],
  "properties": {
    "schema": {
      "type": "string"
    },
    "description": {
      "type": "string"
    },
    "endpoints": {
      "type": "object",
      "description": "Absolute URLs and URI templates for API and discovery resources.",
      "additionalProperties": {
        "type": "string"
      }
    },
    "agent_context": {
      "$ref": "#/$defs/AgentContext"
    },
    "fields": {
      "type": "object",
      "additionalProperties": {
        "type": "string"
      }
    }
  },
  "additionalProperties": false,
  "$defs": {
    "AgentContext": {
      "type": "object",
      "required": [
        "summary",
        "why_it_matters",
        "use_cases",
        "economic_note"
      ],
      "properties": {
        "summary": {
          "type": "string"
        },
        "why_it_matters": {
          "type": "string"
        },
        "use_cases": {
          "type": "array",
          "items": {
            "type": "string"
          }
        },
        "economic_note": {
          "type": "string"
        }
      },
      "additionalProperties": false
    }
  }
}